{
  "url": "http://localhost:5173/",
  "cookies": [],
  "localStorage": "{\"theme\":\"dark\",\"calendar-view\":\"month\",\"__convexAuthRefreshToken_httpsnotablemouse131convexcloud\":\"jd79xsq5xaj60d16gt7f841et57xqmsj|jh76bds4s1w64sg5ghqntb8qk17xq1ck\",\"__convexAuthJWT_httpsnotablemouse131convexcloud\":\"eyJhbGciOiJSUzI1NiJ9.eyJzdWIiOiJqeDc5NjZ4dmFoanpmN2p5emFxcWNueGtnOTdxZ3YydHxqaDc2YmRzNHMxdzY0c2c1Z2hxbnRiOHFrMTd4cTFjayIsImlhdCI6MTc2NjM0NDE1OSwiaXNzIjoiaHR0cHM6Ly9ub3RhYmxlLW1vdXNlLTEzMS5jb252ZXguc2l0ZSIsImF1ZCI6ImNvbnZleCIsImV4cCI6MTc2NjM0Nzc1OX0.HvDa8oPOCeHCaPcdiLkZ4JuFgBoO5POQTWmKAAM-xQvnYnLcnMuAyriYwGr12nHqztx2n3oHfwCzSUJd9NV8GntByUc6wBhTao1Oom8SJtJLAxoT7-gg2pKoRIpsqXT1ClbqNFDn4tlNsJvHYjhzvBUgQiO001cg0UpukyU95qm5ST0w0tt2nXQvxG7UhLHI86thAVeai6Il3ngOYcEZzwK2gnuVeuOIBYqpMPquv5bwCuAwz6Ti0in_e34sWwnLQ9vMbk5VlShYY_QuwCsYLo2w1u-_VmU4Ku6kaAm3yZqsyhGXMWo_DMRhrv_Nn2SDveHUB4innHHMyKwp40ZQGQ\",\"templateSidebarCollapsed\":\"false\",\"coachAthleteMode\":\"false\",\"sidebar-collapsed\":\"true\",\"upcoming-workouts-collapsed\":\"false\"}",
  "sessionStorage": "{}",
  "timestamp": 1766344261041
}