{
  "url": "http://localhost:5173/?auth=signup",
  "cookies": [],
  "localStorage": "{\"theme\":\"light\",\"calendar-view\":\"month\",\"sidebar-collapsed\":\"false\",\"templateSidebarCollapsed\":\"false\",\"upcoming-workouts-collapsed\":\"false\"}",
  "sessionStorage": "{}",
  "timestamp": 1763322640474
}