{
  "url": "http://localhost:5173/",
  "cookies": [],
  "localStorage": "{\"theme\":\"light\",\"calendar-view\":\"month\",\"sidebar-collapsed\":\"false\",\"__convexAuthJWT_httpsnotablemouse131convexcloud\":\"eyJhbGciOiJSUzI1NiJ9.eyJzdWIiOiJqeDc5NjZ4dmFoanpmN2p5emFxcWNueGtnOTdxZ3YydHxqaDdkc3FoNnY1MnhlcjVqeTI1M2I5dHYwZDd2ZjB2eCIsImlhdCI6MTc2MzIzNzYwNSwiaXNzIjoiaHR0cHM6Ly9ub3RhYmxlLW1vdXNlLTEzMS5jb252ZXguc2l0ZSIsImF1ZCI6ImNvbnZleCIsImV4cCI6MTc2MzI0MTIwNX0.djo0rO9EbwWCFkFnVZ6v_K598UYGPgj7GHcg6D3WK5tYnsyu1g6BhseWE6knlxSrROEb0bXtKC6J8bAhCqIVrkwiNi_YUYaZfasyaFBSMM1vUTO98PZfw7n92PPagt6knVP8THptNXxaWQmaOXB-usRmFET9_FN2tLAcSU81tw2qPn7ipYNLJ42hWZFJmfcRSi23OnSInyDlpw_DUQ17qoQESPAPXlD8x4YWAnq0ATnEJdJ8TOXgL4MCLepip5zj0A-nFTkMVXqeYDwG6Da0Sq1kAnIQi-HgimEgEsNRP9rkgXhUrglurdrWRvv0BBPgIFWmllbxS29mGnWAMfoXrw\",\"__convexAuthRefreshToken_httpsnotablemouse131convexcloud\":\"jd750dzmgsjw9y6yb4kjmj2k4n7vemep|jh7dsqh6v52xer5jy253b9tv0d7vf0vx\",\"templateSidebarCollapsed\":\"false\",\"upcoming-workouts-collapsed\":\"false\"}",
  "sessionStorage": "{}",
  "timestamp": 1763237613496
}